<?xml version="1.0" encoding="UTF-8"?>
<cameraConfigurationFile xsi:noNamespaceSchemaLocation="camera_configuration_schema.xsd" xmlns:xsi="http://www.w3.org/2001/XMLSchema-instance">
  <cameraDesignStandard>ONVIF</cameraDesignStandard>
  <id>dahua_ptz</id>
  <url>http://192.168.1.109/onvif_device</url>
  <username>admin</username>
  <password>softwareplatform2018</password>
  <viewCapabilities isPTZ="true">
    <ptzType>P</ptzType>
    <ptzType>T</ptzType>
    <ptzType>Z</ptzType>
    <ptzControl>CONT</ptzControl>
    <viewAngle>62</viewAngle>
    <maxPanViewAngle>147.5</maxPanViewAngle>
    <minPanViewAngle>-147.5</minPanViewAngle>
    <maxTiltViewAngle>45.0</maxTiltViewAngle>
    <minTiltViewAngle>-45.0</minTiltViewAngle>
    <maxZoom>4.0</maxZoom>
    <minZoom>0.0</minZoom>
  </viewCapabilities>
  <cameraOrientation>
      <bearing>45</bearing>
      <roll>180.0</roll>
      <pitch>0.0</pitch>
  </cameraOrientation>
  <location hasCoordinates="true" height2Ground="10.0" latitude="53.947579" longitude="-1.042411" coordinateSys="OUTDOOR"/>
  <additionalAttributes>
    <entry>
      <string>streamProt</string>
      <string>rtsp</string>
    </entry>
    <entry>
      <string>range</string>
      <double>50.0</double>
    </entry>
    <entry>
      <string>resolution</string>
      <string>720</string>
    </entry>
    <entry>
      <string>streamExt</string>
      <string>10554/tcp/av0_0</string>
    </entry>
    <entry>
      <string>pan2Entry</string>
      <string>0</string>
    </entry>
    <entry>
      <string>tilt2Entry</string>
      <string>0</string>
    </entry>
    <entry>
      <string>EntryDirection</string>
      <string>right</string>
    </entry>
    <entry>
      <string>panCalibValue</string>
      <string>10.2</string>
    </entry>
    <entry>
      <string>tiltCalibValue</string>
      <string>2.5</string>
    </entry>
  </additionalAttributes>
</cameraConfigurationFile>