<?xml version="1.0" encoding="UTF-8"?>
<cameraConfigurationFile xsi:noNamespaceSchemaLocation="camera_configuration_schema.xsd" xmlns:xsi="http://www.w3.org/2001/XMLSchema-instance">
  <cameraDesignStandard>ONVIF</cameraDesignStandard>
  <id>dahua_fixed</id>
  <url>http://192.168.1.108/onvif_device</url>
  <username>admin</username>
  <password>softwareplatform2018</password>
  <viewCapabilities isPTZ="false">
    <ptzType>Nil</ptzType>
    <ptzControl>CONT</ptzControl>
    <viewAngle>62</viewAngle>
  </viewCapabilities>
  <cameraOrientation>
      <bearing>45</bearing>
      <roll>180</roll>
      <pitch>0.0</pitch>
  </cameraOrientation>
  <location hasCoordinates="true" height2Ground="10.0" latitude="53.947579" longitude="-1.042411" coordinateSys="INDOOR"/>
  <additionalAttributes>
    <entry>
      <string>streamProt</string>
      <string>rtsp</string>
    </entry>
    <entry>
      <string>range</string>
      <string>50.0</string>
    </entry>
    <entry>
      <string>resolution</string>
      <string>720</string>
    </entry>
    <entry>
      <string>streamExt</string>
      <string>10554/tcp/av0_0</string>
    </entry>
    <entry>
      <string>pairedCamera</string>
      <string>305419896</string>
    </entry>
    <entry>
      <string>pairedCameraPosition</string>
      <string>right</string>
    </entry>
    <entry>
      <string>pairedCameraData</string>
      <string>1</string>
    </entry>
    <entry>
      <string>panCalibValue</string>
      <string>9</string>
    </entry>
    <entry>
      <string>tiltCalibValue</string>
      <string>1</string>
    </entry>
    <entry>
      <string>mapFeature_Road</string>
      <platform.map.SimpleMapConfig>
        <swLong>-2</swLong>
        <swLat>53</swLat>
        <neLong>0</neLong>
        <neLat>54</neLat>
        <coordinateSys>OUTDOOR</coordinateSys>
      </platform.map.SimpleMapConfig>
    </entry>
  </additionalAttributes>
</cameraConfigurationFile>