<?xml version="1.0" encoding="UTF-8"?>

<cameraConfigurationFile xsi:noNamespaceSchemaLocation="camera_configuration_schema.xsd" id="744f10b7-d9ea-4021-9e1d-a3b04221b2ac" url="000.000.0.00:0" username="admin" password="" xmlns:xsi="http://www.w3.org/2001/XMLSchema-instance" streamURI="" cameraDesignStandard="SIM">
  <viewCapabilities viewAngle="62" isPTZ="true" maxPanViewAngle="147.5" minPanViewAngle="-147.5" maxTiltViewAngle="45.0" minTiltViewAngle="-45.0" maxZoom="0.0" minZoom="0.0">
    <ptzType>P</ptzType>
    <ptzType>T</ptzType>
    <ptzControl>CONT</ptzControl>
  </viewCapabilities>
  <cameraOrientation>
    <globalVector>
      <bearing>0.0</bearing>
      <roll>0.0</roll>
      <pitch>0.0</pitch>
    </globalVector>
  </cameraOrientation>
  <location hasCoordinates="true" height2Ground="10.0" latitude="53.947503" longitude="-1.042712"/>
  <additionalAttributes>
    <entry>
      <string>streamProt</string>
      <string></string>
    </entry>
    <entry>
      <string>range</string>
      <double>50.0</double>
    </entry>
    <entry>
      <string>resolution</string>
      <string></string>
    </entry>
    <entry>
      <string>streamExt</string>
      <string></string>
    </entry>
  </additionalAttributes>
</cameraConfigurationFile>